{
  "schema": "phasesmith.recipe-proposal.v1",
  "plan_id": "0000000000000000000000000000000000000000000000000000000000000000",
  "proposal_id": "reviewed-ai-recipe-v1",
  "provenance": {
    "kind": "model",
    "name": "gpt-5.6-sol",
    "provider": "OpenAI",
    "version": null,
    "client": "Codex",
    "advisor_packet_id": "0000000000000000000000000000000000000000000000000000000000000000",
    "prompt_sha256": null,
    "request_id": null
  },
  "assumptions": [
    "Replace placeholder plan/packet IDs and selections with exact advisor-packet values."
  ],
  "recipe": {
    "name": "scale-then-position-template",
    "stages": [
      {
        "name": "scale_background",
        "selection": {
          "phase_scale": true,
          "lattice": false,
          "coordinates": false,
          "occupancy": false,
          "u_iso": false,
          "sample_physics": false,
          "instrument_parameters": [],
          "background": true
        },
        "rationale": [
          "Establish scale and the authorized background before correlated terms."
        ]
      },
      {
        "name": "final_authorized_selection",
        "selection": {
          "phase_scale": true,
          "lattice": true,
          "coordinates": false,
          "occupancy": false,
          "u_iso": false,
          "sample_physics": false,
          "instrument_parameters": [
            "zero_shift_deg"
          ],
          "background": true
        },
        "rationale": [
          "Replace this template with the exact maximum_selection from the approved plan."
        ]
      }
    ]
  }
}
